{"deployment_id":"aws-ec2-ssm-cpu-production-role-surface-v1","e2e_class":"non_scientific_bounded_surface","input_lock_sha256":"7bb584da29f1fb55e5f46133a985bd3c249f154643dad5a3469ae737aee497e7","provider_binding_sha256":"f3fceeea6678d48e428ebe8cb19b1ae72859d81b597bc83f2a2eba1fe1cf6154","record_kind":"cloud_production_execution_surface","roles":[{"e2e_receipt_sha256":"2bb126709dbb6ccf026708f13b05fd56e11dbec00bc24195b89ae354025e47b7","entrypoint":["python3","-m","pneuma_lab.cloud.production_runtime","controller"],"gates":{"clean_start":true,"docker_socket_absent":true,"expected_terminal_state":true,"failure_receipt":true,"imds_blocked":true,"no_class_a_secret":true,"no_controller_credentials":true},"image_digest":"sha256:79bc21c066e7913a57993ead104527d55d4d45a3d396507df88904531feac96d","role":"controller","source_sha256":"802a9c6c1a4d97da98be9bba42d290bdb838064cb620f940932c71573ee3bd3b"},{"e2e_receipt_sha256":"56c3350e254ffeaf58cea9a03b6c8bd2efdb7acdcf6041fec206eb235de424f7","entrypoint":["python3","-m","pneuma_lab.cloud.production_runtime","model-server"],"gates":{"clean_start":true,"docker_socket_absent":true,"expected_terminal_state":true,"failure_receipt":true,"imds_blocked":true,"no_class_a_secret":true,"no_controller_credentials":true},"image_digest":"sha256:1fc1d31efbac9293ea673f3aca0286f003cd5671537f4b2c360f5884d54a375f","role":"model-server","source_sha256":"802a9c6c1a4d97da98be9bba42d290bdb838064cb620f940932c71573ee3bd3b"},{"e2e_receipt_sha256":"195b8df9f2f7e3a788695584e2e57e81384bde2cfbe9e774e0aef1106f4e52a6","entrypoint":["python3","-m","pneuma_lab.cloud.production_runtime","benchmark-worker"],"gates":{"clean_start":true,"docker_socket_absent":true,"expected_terminal_state":true,"failure_receipt":true,"imds_blocked":true,"no_class_a_secret":true,"no_controller_credentials":true},"image_digest":"sha256:8b045c9f5cabcbc60fff79e1bf7a429ce78ee1490acdac2274adcbe25fef8872","role":"benchmark-worker","source_sha256":"802a9c6c1a4d97da98be9bba42d290bdb838064cb620f940932c71573ee3bd3b"}],"schema_version":"0.1.0","source_commit":"cefdfafa39a755c8a3b8bc40f61a69e9af6c3d8b","teardown_ref":"cb82a6065198b3425edd2437fc192401594d4821b0db64f4a7d0877bb677c8be"}
