{"deployment_id":"aws-ec2-ssm-cpu-production-role-surface-v1","e2e_class":"non_scientific_bounded_surface","input_lock_sha256":"7bb584da29f1fb55e5f46133a985bd3c249f154643dad5a3469ae737aee497e7","provider_binding_sha256":"f3fceeea6678d48e428ebe8cb19b1ae72859d81b597bc83f2a2eba1fe1cf6154","record_kind":"cloud_production_execution_surface","roles":[{"e2e_receipt_sha256":"7810ac2960a222c4e5a4f235bbbc4e62d2214b1edff0d093e0d9573101b55401","entrypoint":["python3","-m","pneuma_lab.cloud.production_runtime","controller"],"gates":{"clean_start":true,"docker_socket_absent":true,"expected_terminal_state":true,"failure_receipt":true,"imds_blocked":true,"no_class_a_secret":true,"no_controller_credentials":true},"image_digest":"sha256:eb8c8f5bf51e316443212b9e7db57fe9b7596bcf08a6fb00de52f642ad5827cf","role":"controller","source_sha256":"802a9c6c1a4d97da98be9bba42d290bdb838064cb620f940932c71573ee3bd3b"},{"e2e_receipt_sha256":"b0818c9509f48f260192113477125cb130584069a1243b7429468ae2e7c813e8","entrypoint":["python3","-m","pneuma_lab.cloud.production_runtime","model-server"],"gates":{"clean_start":true,"docker_socket_absent":true,"expected_terminal_state":true,"failure_receipt":true,"imds_blocked":true,"no_class_a_secret":true,"no_controller_credentials":true},"image_digest":"sha256:6b175c1d822af623d77a3241c7d0015854881be63c70940733fe8fd5c3a4854f","role":"model-server","source_sha256":"802a9c6c1a4d97da98be9bba42d290bdb838064cb620f940932c71573ee3bd3b"},{"e2e_receipt_sha256":"3008dd5e89038750f56a1666ac450cd4e17fc1825c04745031e5ab8a5be126c4","entrypoint":["python3","-m","pneuma_lab.cloud.production_runtime","benchmark-worker"],"gates":{"clean_start":true,"docker_socket_absent":true,"expected_terminal_state":true,"failure_receipt":true,"imds_blocked":true,"no_class_a_secret":true,"no_controller_credentials":true},"image_digest":"sha256:83f87c3f32aa670a433685b97d59f7b6ab927e6de039f1964a2d6b9e177b00d4","role":"benchmark-worker","source_sha256":"802a9c6c1a4d97da98be9bba42d290bdb838064cb620f940932c71573ee3bd3b"}],"schema_version":"0.1.0","source_commit":"c352c9e0e4459c80cddfbf84cce94d0b4c79aaa4","teardown_ref":"dc82ae43653ba4a487a2f655671a96953ff07e9a85ef9c2e7c4f1e803b4413a6"}
